ID	MP Name	Nature of membership	Start of Term	End of Term	Number of terms	Constituency	State	Political party	Gender	Educational qualifications	Educational qualifications - details	Age	Debates	Private Member Bills	Questions	Attendance	Notes	National Debates average	National Private Member Bills average	National Questions average	National Attendance average	State's Debates average	State's Private Member Bills average	State Questions	State's Attendance average		House
1392	A. Ganeshamurthi	Elected	Thursday, September 5, 2013	In office		Erode	Tamil Nadu	Marumalarchi Dravida Munnetra Kazhagam	Male	Graduate	B.A. (Economics); Educated at Thayagaraja College, Chennai, Tamil Nadu.	66	30	0	418	71%	(Data corresponds to the period 3 Jun 2009 to 21 Feb 2014.)	37.9	0.8	300	76%	47.2	0.4	398	69%		Lok Sabha
1393	A.K.S. Vijayan	Elected	Thursday, December 20, 2012	In office		Nagapattinam	Tamil Nadu	Dravida Munnetra Kazhagam	Male	Graduate	B.A.; Educated at Madras University, Chennai, Tamil Nadu	52	31	0	440	57%	(Data corresponds to the period 3 Jun 2009 to 21 Feb 2014.)	37.9	0.8	300	76%	47.2	0.4	398	69%		Lok Sabha
1394	A.T. Nana Patil	Elected	Monday, May 18, 2009	In office		Jalgaon	Maharashtra	Bharatiya Janata Party	Male	Graduate	M.Com (2nd Year Appearing)	52	69	10	641	80%	(Data corresponds to the period 3 Jun 2009 to 21 Feb 2014.)	37.9	0.8	300	76%	28.8	1.7	500	74%		Lok Sabha
1395	Abdul Mannan Hossain	Elected	Monday, May 18, 2009	In office		Murshidabad	West Bengal	Indian National Congress	Male	Graduate	B.A.; Educated at R.K.N.College	61	0	0	0	59%	(Data corresponds to the period 3 Jun 2009 to 21 Feb 2014.)	37.9	0.8	300	76%	43.5	0.8	175	72%		Lok Sabha
1396	Abdul Rahman	Elected	Monday, May 18, 2009	In office		Vellore	Tamil Nadu	Dravida Munnetra Kazhagam	Male	Post Graduate	M.A. (Economics), Diploma in Computer Programming; Educated at Jamal Mohamed College, Tiruchhrappalli, Tamil Nadu, Institute of Business Applications, Chennai.	54	37	0	583	68%	(Data corresponds to the period 3 Jun 2009 to 21 Feb 2014.)	37.9	0.8	300	76%	47.2	0.4	398	69%		Lok Sabha
1397	Abhijit Mukherjee	Elected	Saturday, October 13, 2012	In office		Jangipur	West Bengal	Indian National Congress	Male	Graduate	B.E. (Mech.), F.I.E./Chartered Engineer Educated at Jadavpur University, Kolkata and Institution of Engineers Kolkata	54	3	0	22	98%	(Data corresponds to the period 3 Jun 2009 to 21 Feb 2014.)	9.1	0.2	85	76%	9.5	0.1	43	72%		Lok Sabha
1398	Abu Hasem Khan Choudhury	Elected	Monday, May 18, 2009	In office		Maldaha Dakshin	West Bengal	Indian National Congress	Male	Graduate		76	3	0	8	77%	This MP was appointed a minister in Oct, 2012. Ministers represent the government, so we do not report their participation. Participation and attendance details for this MP are thus available only till 7th Sep, 2012. (Data corresponds to the period 3 Jun 2009 to 21 Feb 2014.)	28.8	0.6	215	76%	34	0.7	132	72%		Lok Sabha
1399	Adagooru H Vishwanath	Elected	Monday, May 18, 2009	In office		Mysore	Karnataka	Indian National Congress	Male	Graduate	B.Sc., LL.B.; Educated at Mysore University and Sharada Vilasa La College, Mysore, Karnataka	64	2	0	344	61%	(Data corresponds to the period 3 Jun 2009 to 21 Feb 2014.)	37.9	0.8	300	76%	21.2	0.2	350	68%		Lok Sabha
1400	Adhi Sankar	Elected	Monday, May 18, 2009	In office		Kallakurichi	Tamil Nadu	Dravida Munnetra Kazhagam	Male	Graduate	B.Sc., B.L.; Educated at University of Madras (Tamil Nadu)	56	12	0	178	58%	(Data corresponds to the period 3 Jun 2009 to 21 Feb 2014.)	37.9	0.8	300	76%	47.2	0.4	398	69%		Lok Sabha
1401	Adhir Ranjan Chowdhury	Elected	Monday, May 18, 2009	In office		Baharampur	West Bengal	Indian National Congress	Male	Under Matric	Educated at I.C. Institute, Berhampore, West Bengal	57	88	18	309	82%	This MP was appointed a minister in Oct, 2012. Ministers represent the government, so we do not report their participation. Participation and attendance details for this MP are thus available only till 7th Sep, 2012. (Data corresponds to the period 3 Jun 2009 to 21 Feb 2014.)	28.8	0.6	215	76%	34	0.7	132	72%		Lok Sabha
1402	Agatha K. Sangma	Elected	Monday, May 18, 2009	In office		Tura	Meghalaya	Nationalist Congress Party	Female	Post Graduate	M.A. (Environmental Management); Diploma in Cyber Laws; Diploma in Corporate Laws; Diploma in Human Rights Laws; Diploma in Securities & Investment Laws	33	0	0	0	49%	This MP was a Minister. She tendered her resignation on 28th Oct, 2012. Ministers represent the government in debates, so we do not report their participation. Participation and attendance details for this MP are thus available only from 29th Oct, 2012. (Data corresponds to the period 3 Jun 2009 to 21 Feb 2014.)	9.1	0.2	85	76%	1.5	0	14	67%		Lok Sabha
1403	Ajay Kumar	Elected	Monday, August 1, 2011	In office		Jamshedpur	Jharkhand	Jharkhand Vikas Morcha (Prajatantrik)	Male	Professional Graduate	MBBS, IPS	51	55	3	192	76%	(Data corresponds to the period 3 Jun 2009 to 21 Feb 2014.)	22	0.4	182	76%	26.5	0.6	142	66%		Lok Sabha
1404	Ajay Maken	Elected	Monday, May 18, 2009	In office		New Delhi	Delhi	Indian National Congress	Male	Graduate	B.A.; Educated at University of Delhi	50	0	0	0	37%	This MP was a Minister. He tendered his resignation on 16th Jun, 2013. Ministers represent the government in debates, so we do not report their participation. Participation and attendance details for this MP are thus available only from 5th Aug, 2013. (Data corresponds to the period 3 Jun 2009 to 21 Feb 2014.)	4.3	0	35	76%	1.7	0	32	84%		Lok Sabha
1405	Ajit Singh	Elected	Monday, May 18, 2009	In office		Baghpat	Uttar Pradesh	Rashtriya Lok Dal	Male	Post Graduate	B.Sc., B. Tech. and M.S.; Educated at Lucknow University, Lucknow; I.I.T. Kharagpur and Illinois Institute of Technology, Chicago (U.S.A.)	75	2	0	0	44%	This MP was appointed a minister on 18th Dec, 2011. Ministers represent the government, so we do not report their participation. Participation and attendance details for this MP are thus available only till 16th Dec, 2011. (Data corresponds to the period 3 Jun 2009 to 21 Feb 2014.)	20.2	0.4	160	76%	24.4	0.3	132	79%		Lok Sabha
1406	Akhilesh Yadav	Elected	Monday, May 18, 2009	Sunday, February 5, 2012		Kannauj	Uttar Pradesh	Samajwadi Party	Male	Post Graduate	B.E., M.E.; Educated at University of Mysore, Mysore, Karnataka	40	4	0	0	53%	(Data corresponds to the period 3 Jun 2009 to 21 Feb 2014.)	24.7	0.6	183	76%	28.9	0.4	152	79%		Lok Sabha
1407	Amarnath Pradhan	Elected	Monday, May 18, 2009	In office		Sambalpur	Orissa	Indian National Congress	Male	Graduate	B.A., Utkal University, Bhubaneswar, Orissa	55	26	0	187	85%	(Data corresponds to the period 3 Jun 2009 to 21 Feb 2014.)	37.9	0.8	300	76%	35	0.9	382	74%		Lok Sabha
1408	Ambica Banerjee	Elected	Monday, May 18, 2009	In office		Howrah	West Bengal	All India Trinamool Congress	Male	Graduate	Mechanical Engineer (Sales); Educated at Hatfield Technical College, London	85	3	0	154	60%	Complete attendance for this MP is not available (Data corresponds to the period 3 Jun 2009 to 21 Feb 2014.)	33.3	0.8	258	76%	38.9	0.8	155	72%		Lok Sabha
1409	Anand Prakash Paranjpe	Elected	Monday, May 18, 2009	In office		Kalyan	Maharashtra	Shiv Sena	Male	Post Graduate	B.E., M.B.A.; Educated at Pune University, Maharashtra	40	11	0	820	68%	(Data corresponds to the period 3 Jun 2009 to 21 Feb 2014.)	37.9	0.8	300	76%	28.8	1.7	500	74%		Lok Sabha
1410	Anandrao Adsul	Elected	Monday, May 18, 2009	In office		Amravati	Maharashtra	Shiv Sena	Male	Graduate	B.Com.; Educated at Shivaji University, Kolhapur, Maharashtra	66	35	3	1266	74%	(Data corresponds to the period 3 Jun 2009 to 21 Feb 2014.)	37.9	0.8	300	76%	28.8	1.7	500	74%		Lok Sabha
1411	Anant Gangaram Geete	Elected	Monday, May 18, 2009	In office		Raigad	Maharashtra	Shiv Sena	Male	Matric	Educated at Mumbai Board (Formerly Pune Board), Ratnagiri (Maharashtra)	62	55	1	10	73%	(Data corresponds to the period 3 Jun 2009 to 21 Feb 2014.)	37.9	0.8	300	76%	28.8	1.7	500	74%		Lok Sabha
1412	Anant Kumar Hegde	Elected	Monday, May 18, 2009	In office		Uttara Kannada	Karnataka	Bharatiya Janata Party	Male	Inter/ Higher Secondary	Educated at M.M. Arts and Science College, Sirsi (Karnataka)	45	14	2	574	72%	(Data corresponds to the period 3 Jun 2009 to 21 Feb 2014.)	37.9	0.8	300	76%	21.2	0.2	350	68%		Lok Sabha
1413	Ananth Kumar	Elected	Monday, May 18, 2009	In office		Bangalore South	Karnataka	Bharatiya Janata Party	Male	Graduate	B.A., LL.B. (Spl.); Educated at K.S. Arts College and J.S.S. Law College, Karnataka University, Hubli (Karnataka)	54	23	0	234	84%	(Data corresponds to the period 3 Jun 2009 to 21 Feb 2014.)	37.9	0.8	300	76%	21.2	0.2	350	68%		Lok Sabha
1414	Anantha Venkatarami Reddy	Elected	Monday, May 18, 2009	In office		Anantapur	Andhra Pradesh	Indian National Congress	Male	Post Graduate	M.A., B.L.; Educated at Sri Venkateswara University and Sri Krishnadevaraya University, Anantapur, Andhra Pradesh	57	14	0	552	74%	(Data corresponds to the period 3 Jun 2009 to 21 Feb 2014.)	37.9	0.8	300	76%	20.3	0.4	339	68%		Lok Sabha
1415	Andimuthu Raja	Elected	Monday, May 18, 2009	In office		Nilgiris	Tamil Nadu	Dravida Munnetra Kazhagam	Male	Post Graduate	B.Sc., B.L., M.L.; Educated at Government Arts College, Musiri, Distt. Trichy; Government Law College, Madurai and Government Law College, Trichy (Tamil Nadu)	50	0	0	0	38%	This MP was a Minister. He tendered his resignation on 14th Nov, 2010. Ministers represent the government in debates, so we do not report their participation. Participation and attendance details for this MP are thus available only from 15th Nov, 2010. (Data corresponds to the period 3 Jun 2009 to 21 Feb 2014.)	25.9	0.5	215	76%	33.9	0.3	303	69%		Lok Sabha
1416	Anirudhan Sampath	Elected	Monday, May 18, 2009	In office		Attingal	Kerala	Communist Party of India (Marxist)	Male	Post Graduate	M.A. (Eco) L.L.M (Constt. Law)	51	93	1	400	77%	(Data corresponds to the period 3 Jun 2009 to 21 Feb 2014.)	37.9	0.8	300	76%	69.4	1.5	416	79%		Lok Sabha
1417	Annu Tandon	Elected	Monday, May 18, 2009	In office		Unnao	Uttar Pradesh	Indian National Congress	Female	Graduate	B.Sc. (Chemistry, Zoology and Botany); Dayanand Subhash National Post Graduate College, Unnao (Uttar Pradesh)	56	30	0	307	93%	(Data corresponds to the period 3 Jun 2009 to 21 Feb 2014.)	37.9	0.8	300	76%	43.9	0.4	254	79%		Lok Sabha
1418	Anto Antony	Elected	Monday, May 18, 2009	In office		Pathanamthitta	Kerala	Indian National Congress	Male	Graduate	B.A.; Educated at St. Thomas College, Palai	56	79	0	618	86%	(Data corresponds to the period 3 Jun 2009 to 21 Feb 2014.)	37.9	0.8	300	76%	69.4	1.5	416	79%		Lok Sabha
1419	Anup Kumar Saha	Elected	Monday, May 18, 2009	In office		Bardhaman Purba	West Bengal	Communist Party of India (Marxist)	Male	Doctorate	M.B.B.S., M.S. (Surgery), Ph.D. (Pursuing); Educated at Burdwan Medical College, and University College of Medicine, Calcutta, West Bengal	58	21	0	101	87%	(Data corresponds to the period 3 Jun 2009 to 21 Feb 2014.)	37.9	0.8	300	76%	43.5	0.8	175	72%		Lok Sabha
1420	Anurag Singh Thakur	Elected	Monday, May 18, 2009	In office		Hamirpur	Himachal Pradesh	Bharatiya Janata Party	Male	Graduate	B.A.; Educated at Doaba College, Jalandhar, Punjab	39	72	1	612	85%	(Data corresponds to the period 3 Jun 2009 to 21 Feb 2014.)	37.9	0.8	300	76%	86.3	0.6	337	92%		Lok Sabha
1421	Arjun Charan Sethi	Elected	Monday, May 18, 2009	In office		Bhadrak	Orissa	Biju Janata Dal	Male	Post Graduate	M.A.; Educated at K.C. Vidyamandir, Agarpada, Bhadrak College, University College , Vani Vihar, Bhubaneswar, Orissa	72	49	0	199	85%	(Data corresponds to the period 3 Jun 2009 to 21 Feb 2014.)	37.9	0.8	300	76%	35	0.9	382	74%		Lok Sabha
1422	Arjun Munda	Elected	Monday, May 18, 2009	In office		Jamshedpur	Jharkhand	Bharatiya Janata Party	Male	Graduate	Graduate, Diploma in Social Science; Educated at IGNOU	45	3	0	152	43%	Complete attendance for this MP is not available (Data corresponds to the period 3 Jun 2009 to 21 Feb 2014.)	13.1	0.3	108	76%	9.7	0.2	103	66%		Lok Sabha
1423	Arjun Ram Meghwal	Elected	Monday, May 18, 2009	In office		Bikaner	Rajasthan	Bharatiya Janata Party	Male	Post Graduate	M.A. (Pol. Science); Educated at Sri Dungar College, Bikaner and University of Phillipine, Phillipines	60	430	20	749	99%	(Data corresponds to the period 3 Jun 2009 to 21 Feb 2014.)	37.9	0.8	300	76%	51.5	1	304	88%		Lok Sabha
1424	Arjun Roy	Elected	Monday, May 18, 2009	In office		Sitamarhi	Bihar	Janata Dal (United)	Male	Doctorate	Ph.D; Educated at University of Bihar, Bihar	42	28	0	349	92%	(Data corresponds to the period 3 Jun 2009 to 21 Feb 2014.)	37.9	0.8	300	76%	45.1	0.7	331	87%		Lok Sabha
1425	Arun Subhashchandra Yadav	Elected	Monday, May 18, 2009	In office		Khandwa	Madhya Pradesh	Indian National Congress	Male	Graduate	B.Com.; Schooling at Daly College, Indore, Madhya Pradesh, S.S. Subdh Jain Commerce College, Jaipur, Rajasthan	40	4	0	25	58%	This MP was a Minister. He tendered his resignation on 12th Jul, 2011. Ministers represent the government in debates, so we do not report their participation. Participation and attendance details for this MP are thus available only from 13th Jul, 2011. (Data corresponds to the period 3 Jun 2009 to 21 Feb 2014.)	22	0.4	182	76%	30	0.4	148	82%		Lok Sabha
1426	Aruna Kumar Vundavalli	Elected	Monday, May 18, 2009	In office		Rajahmundry	Andhra Pradesh	Indian National Congress	Male	Graduate	B.Com, B.L.; Educated at Govt. College Rajamundry and C.R. Reddy Law College, Eluru	59	19	0	33	92%	(Data corresponds to the period 3 Jun 2009 to 21 Feb 2014.)	37.9	0.8	300	76%	20.3	0.4	339	68%		Lok Sabha
1427	Arvind Kumar Chaudhary	Elected	Monday, May 18, 2009	In office		Basti	Uttar Pradesh	Bahujan Samaj Party	Male	Inter/ Higher Secondary		49	4	0	190	96%	(Data corresponds to the period 3 Jun 2009 to 21 Feb 2014.)	37.9	0.8	300	76%	43.9	0.4	254	79%		Lok Sabha
1428	Arvind Kumar Sharma	Elected	Monday, May 18, 2009	In office		Karnal	Haryana	Indian National Congress	Male	Post Graduate	B.D.S., M.D.S.; Eduated at Gujarat University, Ahmedabad, M.D. University, Rohtak	50	17	0	93	68%	(Data corresponds to the period 3 Jun 2009 to 21 Feb 2014.)	37.9	0.8	300	76%	13.1	0.1	231	69%		Lok Sabha
1429	Asaduddin Owaisi	Elected	Monday, May 18, 2009	In office		Hyderabad	Andhra Pradesh	All India Majlis-e-Ittehadul Muslimeen	Male	Graduate	LL.B (London), Bar-At-Law (Lincolns Inn); Educated at Hyderabad Public School, St. Marys Junior College and Nizam College	44	40	1	1129	69%	(Data corresponds to the period 3 Jun 2009 to 21 Feb 2014.)	37.9	0.8	300	76%	20.3	0.4	339	68%		Lok Sabha
1430	Ashok Argal	Elected	Monday, May 18, 2009	In office		Bhind	Madhya Pradesh	Bharatiya Janata Party	Male	Inter/ Higher Secondary	Educated at Morena Board of Secondary Education, Madhya Pradesh	45	89	0	180	92%	(Data corresponds to the period 3 Jun 2009 to 21 Feb 2014.)	37.9	0.8	300	76%	46.6	0.4	233	82%		Lok Sabha
1431	Ashok Kumar Rawat	Elected	Monday, May 18, 2009	In office		Misrikh	Uttar Pradesh	Bahujan Samaj Party	Male	Post Graduate	M.A.; Educated at Lucknow University, Lucknow, Uttar Pradesh	38	42	0	819	86%	(Data corresponds to the period 3 Jun 2009 to 21 Feb 2014.)	37.9	0.8	300	76%	43.9	0.4	254	79%		Lok Sabha
1432	Ashok Tanwar	Elected	Monday, May 18, 2009	In office		Sirsa	Haryana	Indian National Congress	Male	Post Graduate	M.A., M.Phil (History); Educated at Jawahar Lal Nehru University, New Delhi	38	4	0	223	79%	(Data corresponds to the period 3 Jun 2009 to 21 Feb 2014.)	37.9	0.8	300	76%	13.1	0.1	231	69%		Lok Sabha
1433	Ashwamedh Devi	Elected	Monday, May 18, 2009	In office		Ujiarpur	Bihar	Janata Dal (United)	Female	Under Matric	Educated at Govt. Middle School, Bajitpur Meyari, Sarai Ranjan, Samastipur, Bihar	46	9	0	145	89%	(Data corresponds to the period 3 Jun 2009 to 21 Feb 2014.)	37.9	0.8	300	76%	45.1	0.7	331	87%		Lok Sabha
1434	Asrarul Haque Mohammad	Elected	Monday, May 18, 2009	In office		Kishanganj	Bihar	Indian National Congress	Male	Post Graduate	Fazil (M.A.); Educated at Darul Uloom, Deoband, Uttar Pradesh	72	18	0	56	94%	(Data corresponds to the period 3 Jun 2009 to 21 Feb 2014.)	37.9	0.8	300	76%	45.1	0.7	331	87%		Lok Sabha
1435	Avtar Singh Bhadana	Elected	Monday, May 18, 2009	In office		Faridabad	Haryana	Indian National Congress	Male	Under Matric		56	14	0	231	46%	(Data corresponds to the period 3 Jun 2009 to 21 Feb 2014.)	37.9	0.8	300	76%	13.1	0.1	231	69%		Lok Sabha
1436	Awale Jaywant Gangaram	Elected	Monday, May 18, 2009	In office		Latur	Maharashtra	Indian National Congress	Male	Inter/ Higher Secondary		73	51	0	350	91%	(Data corresponds to the period 3 Jun 2009 to 21 Feb 2014.)	37.9	0.8	300	76%	28.8	1.7	500	74%		Lok Sabha
1437	Babu Lal Marandi	Elected	Monday, May 18, 2009	In office		Kodarma	Jharkhand	Jharkhand Vikas Morcha (Prajatantrik)	Male	Graduate	Educated at Ranchi University, Ranchi, Jharkhand	56	2	0	0	29%	(Data corresponds to the period 3 Jun 2009 to 21 Feb 2014.)	37.9	0.8	300	76%	38.8	0.8	251	66%		Lok Sabha
1438	Badri Ram Jakhar	Elected	Monday, May 18, 2009	In office		Pali	Rajasthan	Indian National Congress	Male	Under Matric		61	24	0	513	88%	(Data corresponds to the period 3 Jun 2009 to 21 Feb 2014.)	37.9	0.8	300	76%	51.5	1	304	88%		Lok Sabha
1439	Badruddin Ajmal	Elected	Monday, May 18, 2009	In office		Dhubri	Assam	Assam United Democratic Front	Male	Post Graduate	Fazil-e-Deoband (Masters in Islamic Theology and Arabic); Educated at Darul Uloom, Deoband, Uttar Pradesh	64	30	0	320	49%	(Data corresponds to the period 3 Jun 2009 to 21 Feb 2014.)	37.9	0.8	300	76%	22.1	0.5	83	80%		Lok Sabha
1440	Baidyanath Prasad Mahto	Elected	Monday, May 18, 2009	In office		Valmiki Nagar	Bihar	Janata Dal (United)	Male	Matric	Educated at H.S. Bathanaha, West Champaran (Bihar)	66	28	0	301	92%	(Data corresponds to the period 3 Jun 2009 to 21 Feb 2014.)	37.9	0.8	300	76%	45.1	0.7	331	87%		Lok Sabha
1441	Baijayant Jay Panda	Elected	Monday, May 18, 2009	In office		Kendrapara	Orissa	Biju Janata Dal	Male	Graduate	Dual Degree Course in Engineering and Management in Communications; Educated at Michigan Technological University, U.S.A.	50	18	12	878	66%	(Data corresponds to the period 3 Jun 2009 to 21 Feb 2014.)	37.9	0.8	300	76%	35	0.9	382	74%		Lok Sabha
1442	Baju Ban Riyan	Elected	Monday, May 18, 2009	In office		Tripura East	Tripura	Communist Party of India (Marxist)	Male	Graduate	B.Sc.; Educated at Maharaja Bira Bikram College, Agartala, Tripura	72	6	0	0	85%	(Data corresponds to the period 3 Jun 2009 to 21 Feb 2014.)	37.9	0.8	300	76%	21.5	0.5	155	80%		Lok Sabha
1443	Bal Kumar Patel	Elected	Monday, May 18, 2009	In office		Mirzapur	Uttar Pradesh	Samajwadi Party	Male	Inter/ Higher Secondary	Educated at Bhauri Intermediate College, Distt. Chitrakoot, Uttar Pradesh	50	11	0	280	80%	(Data corresponds to the period 3 Jun 2009 to 21 Feb 2014.)	37.9	0.8	300	76%	43.9	0.4	254	79%		Lok Sabha
1444	Baliram	Elected	Monday, May 18, 2009	In office		Lalganj	Uttar Pradesh	Bahujan Samaj Party	Male	Doctorate	M.A., M.Ed., Ph.D.; Educated at Banaras Hindu University (BHU), Varanasi, Uttar Pradesh	59	51	0	351	94%	(Data corresponds to the period 3 Jun 2009 to 21 Feb 2014.)	37.9	0.8	300	76%	43.9	0.4	254	79%		Lok Sabha
1445	Baliram Kashyap	Elected	Monday, May 18, 2009	Saturday, September 3, 2011		Bastar	Chhattisgarh	Bharatiya Janata Party	Male	Under Matric		77	0	0	0	1%	Complete attendance for this MP is not available (Data corresponds to the period 3 Jun 2009 to 21 Feb 2014.)	14.4	0.3	114	76%	5.3	0	53	60%		Lok Sabha
1446	Balkrishna Khanderao Shukla	Elected	Monday, May 18, 2009	In office		Vadodara	Gujarat	Bharatiya Janata Party	Male	Post Graduate	B.Sc., MBA (HRM); Educated at M.S. University of Baroda, Vadodara (Gujarat)	50	27	1	254	65%	(Data corresponds to the period 3 Jun 2009 to 21 Feb 2014.)	37.9	0.8	300	76%	41	1.4	382	76%		Lok Sabha
1447	Bansagopal Chowdhury	Elected	Monday, May 18, 2009	In office		Asansol	West Bengal	Communist Party of India (Marxist)	Male	Graduate	Educated at T.D.B. College, Raniganj, West Bengal	54	24	0	43	61%	(Data corresponds to the period 3 Jun 2009 to 21 Feb 2014.)	37.9	0.8	300	76%	43.5	0.8	175	72%		Lok Sabha
1448	Bapiraju Kanumuri	Elected	Monday, May 18, 2009	In office		Narsapuram	Andhra Pradesh	Indian National Congress	Male	Inter/ Higher Secondary	Educated at Hyderabad Public School	66	11	0	0	87%	(Data corresponds to the period 3 Jun 2009 to 21 Feb 2014.)	37.9	0.8	300	76%	20.3	0.4	339	68%		Lok Sabha
1449	Basori Singh Masram	Elected	Monday, May 18, 2009	In office		Mandla	Madhya Pradesh	Indian National Congress	Male	Under Matric	Educated at Higher Secondary School, Bichhiya and Middle School, Tatri, Distt. Mandla, Madhya Pradesh	68	1	0	10	84%	(Data corresponds to the period 3 Jun 2009 to 21 Feb 2014.)	37.9	0.8	300	76%	46.6	0.4	233	82%		Lok Sabha
1450	Basudeb Acharia	Elected	Monday, May 18, 2009	In office		Bankura	West Bengal	Communist Party of India (Marxist)	Male	Post Graduate	M.A., B.T.; Educated at Ranchi University, Ranchi, Bihar and Calcutta University, Calcutta, West Bengal	71	143	7	218	88%	(Data corresponds to the period 3 Jun 2009 to 21 Feb 2014.)	37.9	0.8	300	76%	43.5	0.8	175	72%		Lok Sabha
1451	Beni Prasad Verma	Elected	Monday, May 18, 2009	In office		Gonda	Uttar Pradesh	Indian National Congress	Male	Graduate	B.A., LL.B.; Educated at Lucknow University, Lucknow, Uttar Pradesh	73	2	0	0	99%	This MP was appointed a minister in Jan, 2011. Ministers represent the government, so we do not report their participation. Participation and attendance details for this MP are thus available only till 13th Dec, 2010. (Data corresponds to the period 3 Jun 2009 to 21 Feb 2014.)	12.5	0.3	103	76%	15.5	0.2	79	79%		Lok Sabha
1452	Bhajan Lal	Elected	Monday, May 18, 2009	Sunday, March 6, 2011		Hisar	Haryana	Haryana Janhit Congress	Male	Inter/ Higher Secondary	Educated at Government College, Bahawal Nagar (Now in Pakistan)	83	0	0	0	39%	(Data corresponds to the period 3 Jun 2009 to 21 Feb 2014.)	15.9	0.4	119	76%	3.9	0	63	69%		Lok Sabha
1453	Bhakta Charan Das	Elected	Monday, May 18, 2009	In office		Kalahandi	Orissa	Indian National Congress	Male	Graduate	B.A., LL.B.; Educated at Government College, Bhawanipatna, Kalahandi, Orissa and L. R. Law College, Sambalpur (Orissa)	55	51	1	252	90%	(Data corresponds to the period 3 Jun 2009 to 21 Feb 2014.)	37.9	0.8	300	76%	35	0.9	382	74%		Lok Sabha
1454	Bharat Ram Meghwal	Elected	Monday, May 18, 2009	In office		Ganganagar	Rajasthan	Indian National Congress	Male	Graduate	B.A., B.Ed.; Educated at Rajasthan University, Jaipur and Kota	58	18	0	200	90%	(Data corresponds to the period 3 Jun 2009 to 21 Feb 2014.)	37.9	0.8	300	76%	51.5	1	304	88%		Lok Sabha
1455	Bharatsinh Madhavsinh Solanki	Elected	Monday, May 18, 2009	In office		Anand	Gujarat	Indian National Congress	Male	Graduate	B.E. (Civil); Educated at Birla Vishwakarma Mahavidyalay	60	N/A	N/A	N/A	N/A	This MP is a minister. Ministers represent the government in debates, so we do not report their participation.  They do not sign the attendance register, ask questions, or introduce private member bills. (Data corresponds to the period 3 Jun 2009 to 21 Feb 2014.)	N/A	N/A	N/A	N/A	N/A	N/A	N/A	N/A		Lok Sabha
1456	Bhartruhari Mahtab	Elected	Monday, May 18, 2009	In office		Cuttack	Orissa	Biju Janata Dal	Male	Post Graduate	M.A. (English); Educated at Utkal University, (Orissa)	56	234	1	395	94%	(Data corresponds to the period 3 Jun 2009 to 21 Feb 2014.)	37.9	0.8	300	76%	35	0.9	382	74%		Lok Sabha
1457	Bhavana Pundlikrao Gawali Patil	Elected	Monday, May 18, 2009	In office		Yavatmal-Washim	Maharashtra	Shiv Sena	Female	Graduate	B.A. (Marathi); Educated at Amravati University, Amravati (Maharashtra)	40	19	0	360	67%	(Data corresponds to the period 3 Jun 2009 to 21 Feb 2014.)	37.9	0.8	300	76%	28.8	1.7	500	74%		Lok Sabha
1458	Bhismashankar, Alias Kushal Tiwari	Elected	Monday, May 18, 2009	In office		Sant Kabir Nagar	Uttar Pradesh	Bahujan Samaj Party	Male	Inter/ Higher Secondary		53	45	0	537	79%	(Data corresponds to the period 3 Jun 2009 to 21 Feb 2014.)	37.9	0.8	300	76%	43.9	0.4	254	79%		Lok Sabha
1459	Bhola Singh	Elected	Monday, May 18, 2009	In office		Nawada	Bihar	Bharatiya Janata Party	Male	Doctorate	M.A., Ph.D.; Educated at Patna University and Lalit Narayan Mithila University, Darbhanga, Bihar	79	104	10	398	92%	(Data corresponds to the period 3 Jun 2009 to 21 Feb 2014.)	37.9	0.8	300	76%	45.1	0.7	331	87%		Lok Sabha
1460	Bhoopendra Singh	Elected	Monday, May 18, 2009	In office		Sagar	Madhya Pradesh	Bharatiya Janata Party	Male	Graduate	L.L.B.; Educated at Sagar University (Madhya Pradesh)	53	27	4	625	70%	(Data corresponds to the period 3 Jun 2009 to 21 Feb 2014.)	36.7	0.8	288	76%	45	0.4	227	82%		Lok Sabha
1461	Bhudeo Choudhary	Elected	Monday, May 18, 2009	In office		Jamui	Bihar	Janata Dal (United)	Male	Graduate	B.A., LL.B.; Educated at T.N.V. Law College, Bhagalpur	54	35	0	448	86%	(Data corresponds to the period 3 Jun 2009 to 21 Feb 2014.)	37.9	0.8	300	76%	45.1	0.7	331	87%		Lok Sabha
1462	Bibhu Prasad Tarai	Elected	Monday, May 18, 2009	In office		Jagatsinghpur	Orissa	Communist Party of India	Male	Post Graduate	M.A., LL.B.; Madhusudan Law College, Cuttack and Utkal University, Bhubaneshwar, Orissa	49	26	0	224	82%	(Data corresponds to the period 3 Jun 2009 to 21 Feb 2014.)	37.9	0.8	300	76%	35	0.9	382	74%		Lok Sabha
1463	Bijoy Krishna Handique	Elected	Monday, May 18, 2009	In office		Jorhat	Assam	Indian National Congress	Male	Post Graduate	M.A.; Educated at Calcutta University, Calcutta (West Bengal)	79	0	0	1	92%	This MP was a Minister. He tendered his resignation on 12th Jul, 2011. Ministers represent the government in debates, so we do not report their participation. Participation and attendance details for this MP are thus available only from 13th Jul, 2011. (Data corresponds to the period 3 Jun 2009 to 21 Feb 2014.)	22	0.4	182	76%	13.5	0.4	52	80%		Lok Sabha
